category,tag,user,title,content,imgSrc,createAt,viewCount,likeCount,postReplyLists
okky,lifeStory,ppythonman,그냥 망상글,"현재 AI는 기존껄 학습해서 먼가를 창출하는데
만약에 사람들이 새로운 학습할꺼리를 안만든다면
(출판, 네트워크에 업로드 등등을 멈춤 )
AI 발전은 멈출까요
아니면 다른 무언가로 발전을 할까요?",0,3일 전,438,0,"[{'user': '코가더', 'content': '멈추거나 휴먼이 보기에 이상한 방향으로 갈거 같습니다.\n소름~~~~', 'createAt': '3일전'}, {'user': '더미', 'content': '이미 학습할게 많지않을까요?', 'createAt': '3일전'}, {'user': '월급은나의빛', 'content': '다른 AI 가 만들어 낸 아무 말들을 묶어서 나름의 체계를 만들어 내겠죠. 그걸 또 다른 AI가 인용, 재인용...\n실용적 용도가 없는 사변적인 이야기의 집합이 바로 인문학이니 인문학이 융성하겠네요.', 'createAt': '3일전'}, {'user': 'yamanin', 'content': '현재 학습된 특정버전의 꽤 괜찮은 결과를 뽑아내는 llm을 복제하여, 서로 질문과 답변을 시킨다고 가정하고, 해당 질문과 답변을 계속 추가학습시켰을 경우, 점점 편향되고 단순해질 가능성이 높지 않을까? 싶어요.', 'createAt': '3일전'}, {'user': '와플치킨', 'content': '상업적인 부분에 대한 창의적인 발전은 멈출수 있다고 생각합니다.', 'createAt': '3일전'}, {'user': '컴포지트', 'content': '인간 본능 상 전자로는 절대 불가능합니다. 8억 인구가 일시적으로 같은 생각 가지지 않는 이상...', 'createAt': '3일전'}, {'user': 'n = n + 1', 'content': 'AI 발전도 멈출듯 합니다.\n자의식을 가진 AI가 없는 상태에서는 현재 학습된 데이터를 기반으로\n누군가 질문을 던져야 답변을 해주는 수동식 이니까요.', 'createAt': '2일전'}, {'user': '키리링', 'content': '실제로 해당 내용에 대한 기사가 나온게 있었습니다.\n어디 기사인지는 정확히 기억이 안나는데\nAI들이 인터넷에 있는 자료들을 다 학습하고 나서 AI들이 만든 것을 통해서 학습하게 되면 어떨까 하는 내용이거든요.\n결론은 정확도나 신뢰성 부분이 크게 떨어진다고 합니다.\n즉 AI가 발전할 수 있는 크기는 현재로써는 인터넷에 있는 자료들이 한계이며 이 마저 학습을 다 하고 오히려 AI를 통해 만든 컨텐츠가 많아지면 오히려 정확도가 떨어진다고 합니다.\n\n현재의 기술로써 그렇다는 거고 마찬가지로 기술이 더 발전하면 이것도 극복이 되는 순간이 오지 않을까요?\n\n하지만 그렇게 되려면 사람이 만든 것과 동일할 정도의 컨텐츠가 나와야 하는데 그럴려면 인간과 마찬가지로 오감을 통한 학습을 하고 컨텐츠가 나오는 수준이 되어야 하지 않나 생각합니다. 우리 사람은 자연스레 오감을 느끼고 물리법칙을 느끼지만 AI는 그렇지 않으니까요.\n\n그럼 못해도 AGI는 달성을 해야 될 것 같습니다.\n\n- 이상 제 뇌피셜이었습니다.', 'createAt': '2일전'}, {'user': '한안아', 'content': '어느정도 발전하면 자가학습하여 데이터를 계속 만들어 내면서 스스로 성장합니다...', 'createAt': '2일전'}]"
okky,lifeStory,동까IS뭔들,개발자 현타(슬럼프) 올때 보세요,"백엔드 6년차를 앞두고 있는 사람입니다.
같이 시작한 동기들은 3년차 때 전직하거나(Front Or 기획) 전업하거나(일반 사무 or 서비스 등) 하더라구요.
5년차가 지나니깐 이제 저도 슬슬 현타가 오고, 회사일만 해서 언제 집마련하고 차 좋은거 끌고 하나 싶은 생각이 많아졌습니다.
아무래도 슬럼프가 아닐까 싶어서 주말에 커피숍에서 알바도 해보고, 퇴근 후 술집에서 주방 보조도 해보면서 이것 저것 건드려봤어요.
근데 커피숍에서 사장님이 키오스크 업체 비용은 아까운데 키오스크 가지고 싶다는 말에 bootstrap 템플릿 하나 사서 가게에 맥미니 하나 30에 당근한거 놓고 홈서버 만들어서 키오스크 하나 만들어드리니 엄청 좋아하더라구요.
같은 취지로 술집에도 똑같이 해드리니 돈 백 주시면서 앞으로 유지보수 신경써달라고, 그러면서 사업체 하나 내서 소소하게 자영업자 도와주는 업체 하나 만들면 좋을 것 같다고 조언해주시던데
뭔가 남을 즐겁게하는 개발이 어떤건지 느낌이 오더라구요. 여태껏 누군가 시켜서 영문도 모른체 이 서비스는 누가 사용할 것인가 관심도 없이 개발하다가 실제로 사용자들이 어떤점에서 좋은 경험을 느끼고, 내가 만든 서비스를 바로 내 눈 앞에서 이용하는 것을 보니깐 재밌었어요.

여러분도 현실에 지쳐서 포기하고싶어질때가 있을거에요. 그럴때는 콧바람좀 쐴 겸 다른일을 해보는것도 좋은 것 같더라구요.
그 안에서 새로운 개발 패러다임을 찾을 수 있고, 잃어버린 개발 의욕도 찾을 수 있을거라 믿어요.",0,3일 전,1.5k,18,"[{'user': '코가더', 'content': '포스기 하나 장만 = 백 ??\nㅠㅠ 좀더 받으시면 좋겠네요~', 'createAt': '3일전'}, {'user': 'カワウソ', 'content': '???: 평생 유지보수 아니냐', 'createAt': '3일전'}, {'user': '더미', 'content': '키오스크랑 포스기는 다른거 아니던가요?', 'createAt': '3일전'}, {'user': '스프라이트마시쪙', 'content': '혹시 결제쪽은 어떻게 붙이셨나염??', 'createAt': '3일전'}, {'user': 'qwer1232', 'content': '진짜 재밌겠네여 ㅋㅋㅋ', 'createAt': '3일전'}, {'user': 'hswdreamer', 'content': '저도 스프라이트님이랑 같이 궁금증이 카드리더는 어떤걸로 어케 붙이 셨나요?\n포폴로 키오스크 만들고 싶은데 항상 거기서 걸리던데..', 'createAt': '3일전'}, {'user': 'ziDev zi', 'content': '간접적으로 의욕 받고 갑니다 :)', 'createAt': '2일전'}, {'user': '카니', 'content': '전 아두이노나 라즈베리 만져봅니다..\n요새 하도 잘 되어 있어서, 좀만 찾아보면 간단한 것들은 쉽게 구현이 가능하더군요..\n저도 의욕 챙겨갑니다.. ㅎㅎ', 'createAt': '2일전'}]"
okky,lifeStory,자고시퍼,익숙한것만 하다 보니까,"기술 스텍이라곤 스프링 jsp 마이바티스만 할줄 알고
그나마 레거시에서 최근에 부트로 바꿧고
익숙 하시죠?
네 흔하디 흔한 si에서만 쌓인 기술 경력
배포든 ci/cd든 구축 경험이라곤 x
있는거 환경 전달 받으면 쓰기만 함 (학부나 취준하던 시절때나 경험 해보고 실무 X)
주 업무는 공통, 각 모듈별 기능 개발

ai가 발전하는게 체감이 슬슬 위기감 까지 오는 기분이 들어서 최근에
리엑트든 next js든 새로운것(나한테만) 좀 해보고 있는데
익숙하던것만 하다가 새로운거 해보려니 하기 싫고 아 그냥 하던거로 만들자
이런 자세가 돼버리니까

참 딜레마임
그리고 시키는것만 만들다가 뭐 새로 구상해서 뭘 만들까 생각 해봐도 했던것만 생각나고
변화 싫어 하는 구식 개발자(코더)가 됐습니다
첫 입사땐 이러지 않았는데 참",0,3일 전,464,2,"[{'user': '물음표살인마4', 'content': '완전 공감이네요 .. 저도 똑같은상황입니다 ㅋㅋ', 'createAt': '3일전'}, {'user': 'cozypillow', 'content': '반짝이던 눈이 점점.. 총기를 잃어가고 있습니다', 'createAt': '3일전'}, {'user': '코가더', 'content': '대부분 그러지 않나요??\n아마 생존에 위험이 되지 않는 이상 대가리가 안 돌아가는 거조 ㅡㅡ;', 'createAt': '3일전'}, {'user': '전뚱이인데요', 'content': '경력이 많으신거 같은데 새로운 기술스택 보다는\n아키텍처 설계쪽을 공부하는 쪽이 좋지 않을까요\n설계쪽은 오래 갈거 같은데 ~ 데이터 엔지니어 -> 데이터 사이언스쪽으로 넘어가는것도 나쁘지 않다고 생각합니다.', 'createAt': '1일전'}]"
okky,lifeStory,TTTTIiliil,베트남 개발자 외주 맡겨보고 싶은데 어떻게 해야하나요?,"베트암 개발자 인건비가 저렴하다고 해서, 외주 개발로 모바일 앱을 몇 개씩 만들어보려고 합니다.
샘플 앱으로 몇 가지 만들어보려고 하는데 어떤 창구로 개발 요청하나요?",0,3일 전,702,0,"[{'user': '라떼개발자', 'content': '위시x에 베트남업체 있던데요.\n외주공고 직접 낸적 있는데 지원했길래 알게되었어요.', 'createAt': '3일전'}, {'user': '어쩌다개발자', 'content': '베트남개발자 모두가 그렇지않겠지만 싼값에 시켰다가 후회했다는 얘기 많이들었어요.', 'createAt': '3일전'}, {'user': 'yjy****', 'content': '절대안합니다', 'createAt': '3일전'}, {'user': '포항항', 'content': '결과물은 가격에 맞게 나옵니다', 'createAt': '3일전'}, {'user': '꾸우까', 'content': '샘플이아니라 개발맡기실땐 지시대로 출품이원칙이므로 기획 설계자료 잘넘기셔야합니다\n위 자료들 준비가되셨을거라 생각하는데 그러면 업체에 연락해보시고 공수알려드리면 견적 알려줄거에요~', 'createAt': '3일전'}, {'user': '한안아', 'content': '먹어봐야 똥인지 된장인지 알죠.\n일단 테스트겸 시도해보는것도 좋다고 봅니다.', 'createAt': '2일전'}]"
okky,lifeStory,롤딥,"3년차 백엔드 인데, 이직시 이력서에 뭘 더 넣을 수 있을까요?","이직을 좀 알아보고 있는데

토이 프로젝트로 npm 라이브러리 배포 해둔거나 ec2에 올려서 실제로 돌아가는 서비스 몇개 있는거 적고

현재 재직중인 회사에서 진행했던 경력 사항들 몇개 적고

기술 스택 적고

자격증 있는거 2개 적고 나니까

뭐 더 쓸게 없네용;

뭔가 너무 허전해서 프론트엔드 개발자들 포트폴리오 사이트 만드는거라도 만들어서

토이프로젝트 했던거 정리라도 해야하나.. 싶은데 자기소개서나 경력사항을 더 상세히 적어서 힘을 주는게 더 나을까요?",0,3일 전,568,0,"[{'user': 'Lzlzlzzz', 'content': '저도 넣을게 없어서 영어 성적 따뒀던거 넣었는데, 그걸로 가산점 받아 합격했었네요.', 'createAt': '3일전'}, {'user': '시그널', 'content': '회사에서 한 걸 적으셨으면 된거 같은데요\n얼마나 잘 처리했는지가 중요하지 내용이 많다고 좋은게 아닙니다', 'createAt': '3일전'}, {'user': '코가더', 'content': '토이 프로젝트 다 적으세요..\n개발에 대한 열정이 보여 좋아할거 같습니다.', 'createAt': '3일전'}]"
okky,lifeStory,ppythonman,어제 노트북 들고가서 카페에서 1시간동안 한일,"커피 홀짝 거리기
디비 클라 설치
터미너스 설치
리디북스로 책3페이지 읽기
갑자기 궁금한게 생겨서 챗지피티랑 수다떨기

이제는 공부할때 방해물은 쓸데 없이 하는 인터넷이 문제가 아닙니다.
공부의 주적은 챗지피티 입니다.",0,3일 전,988,4,"[{'user': '삶은개발', 'content': '뭐 많이 하신것 같은데 5번의 점유율이 급 높아지신걸까요 ㅎㅎㅎ', 'createAt': '3일전'}, {'user': '바보쿠우', 'content': '우리 지피티님 >ㅁ<', 'createAt': '3일전'}, {'user': 'n = n + 1', 'content': '의외로 GPT랑 수다떨면 시간이 잘가더라구요 ㅎ', 'createAt': '3일전'}, {'user': '달고양이', 'content': '우리 지피티느님은 간단한 텍스트 게임도 해준다구요!!\n일하는척 게임하기', 'createAt': '3일전'}]"
okky,lifeStory,삶은개발,코딩이 그렇게 꿀잼입니다,"개발이 생활이고 생활도 개발이라 밸런스 맞추기는 참 힘든것 같습니다.
개발은 사실 업이고 일인거라 생활이 더 우선이긴 하죠

유투브에서 개발얘기도 보고 웃긴거도 보고 끌리는것도 보는데
보고난후 허무해질때가 있습니다

하지만 개발은 언제나 재밌습니다 마치 운동 빡세게 한 느낌이죠 상쾌하고 뿌듯합니다.

코딩도 종류가 많겠죠 백엔드냐 프론트냐 모바일이냐 웹이냐 크로스플랫폼이냐 android 냐 ios 냐
기능도 화면단 데이터 영속화 캐싱 푸쉬 과금 서버 연동
설계 시컨스 Diagram Cnc View
각각 맛이 있고 성취감이나 몰입감이 다른것 같긴 하네요

오늘도 내가 짠 코드 혹은 작성한 문서 혹은 실행한 테스트를 시간에 빗대어 나눠 보면서 가치를 판단해 보면 또 다른 재미가 있네요
졸린눈 비비며 늑장 부리느라 늦어진 마감을 맞춰보며 글 남겨 봅니다.
오늘도 모두 즐프 하세요",0,3일 전,989,10,"[{'user': '코가더', 'content': '건강 신경쓰세요', 'createAt': '3일전'}]"
okky,lifeStory,코딩하는나그네타는타조,공부보다 누워서 유튜브 보는게 꿀잼인건 맞죵,"매일 밤 다짐하죠.
""오늘은 꼭 퇴근 하고 토이 프로젝트, 코딩테스트 준비해야지 !!""
그러다 30분 야근하고 지하철타고 퇴근하면 7시반 언저리..
운동갔다 씻고오면 9시 반 언저리..

저녁 먹기 귀찮거나, 너무 늦거나 하면 패스하고..
보일러키고 전기장판 키고 잠깐 누워서 유튜브 보면 그새 11시가 훌쩍

""에잇. 내일은 꼭 알고리즘 한 문제라도 풀어야지!""
매일 밤 반복이죠 허허

중소기업으로 스타트를 한 이상 언제나 이직의 꿈을 가지고 있는데요.
그게 자꾸만.. 현생에 안주해버리게 되는거있죠 ?

오늘 오랜만에 토이프로젝트 진행하면서 느낀건,
""앞으로 개발자로 성장하고 몸 값을 올리기 위해서는 꾸준히 개인 역량을 쌓아야겠다"" 였습니다.

오랜만에 로그인 구현하는데 신경 쓸게 참으로 많네용

모든 여러분들 신년을 맞이해 마음을 다시 잡고 게으름을 잠깐 이겨보는건 어떠신가요.
일단 나부터... ㅠ.ㅠ
뜨끈하게 전기장판에 몸지지고 누워서 유튜브 보는게 ㄹㅇ 개꿀잼;;;;;;;",0,3일 전,512,2,"[{'user': 'leon808', 'content': '개인 공부 안하고 회사 일만 쳐내도 잠정 몸값 올라간다는 기분 드는게 제일 좋은거 같습니다\n그래서 다들 회사 마음에 안 들면 이직 생각하나봐요', 'createAt': '3일전'}, {'user': 'MadMango', 'content': '회사에 머무는 역량으로 남으면 도태될 거 같고..\n다음 이직은 해외로 가고 싶은데 그 길은 좁아보이고..\n지금 일은 손에 안잡히고ㅜㅜ 자야죠', 'createAt': '3일전'}, {'user': '한안아', 'content': '공부보다 중요한게 인맥임!!', 'createAt': '3일전'}, {'user': '코가더', 'content': '만족합시다.. 지금의 삶을..', 'createAt': '3일전'}]"
okky,lifeStory,냉만두,비전공자가 질문 좀 해보겠습니다...,"안녕하세요 말씀 좀 여쭤보겠습니다...

제가 컴덕후라서 컴퓨터에 대해서 지식 쌓고 있고  못쓰는 컴퓨터 갖고 뜯어보고 부품 공부해보고 그러는데 
 그럼 하드웨어로 가는게 낫나요?  근데 용팔이다 사기꾼이다 뭐다 이런말 듣기싫긴 하네요... 
 그리고 정보보안쪽도 관심 있긴한데  하드보다 차라리 보안 하는게 나을까요? 
 원래 보안쪽이 너무 좋아서 컴공 가려다가 수능 성적 안되서 디자인 전공 택했는데 
 지금이라도 보안 가도 될까요? 
 서두없고 정신없이 글 썼는데 이해 바랍니다... 
 급 진지해서 글 써봤습니다  
 3줄요약
 1. 하드웨어vs소프트웨어
 2. 정보보안 전망 좋을까요?
 3. 정보보안에 대해서 정보 좀...",0,3일 전,769,0,"[{'user': '캐티', 'content': '컴퓨터 하드웨어 유튜버를 살펴보면 뚜따 튜닝도 하던데요. 여담으로 전기전자를 끼고 하면 좋을 것 같스빈다.', 'createAt': '3일전'}, {'user': 'n = n + 1', 'content': '하드웨어쪽이라면 단순 조립수준에서는 오래하긴 힘들것으로 보이구요\nPC부품 기판의 고장난 캐퍼시티 교체 등의\n남들이 쉽게 못하는 화타급 울산 ITSystem 을 꿈꾸며 정진한다면 모를까..\n\n그리고 정보보안이... 어떤 정보보안쪽을 하실지..모르지만 어느쪽이던 정보보안이\n희소하고 좀 어렵다 말씀 드리고 싶네요.\n희소해서 요즘은 역으로 괜찮을려나.. 하지만 내년 취업시장 분위기가 많이 경직되어 힘든 한해가 될거 같습니다.\n모쪼록 좋은 결과 있으시길!!', 'createAt': '3일전'}, {'user': '천사와악마', 'content': '하드웨어 == 임베디드라고 생각하신다면 님이 생각한 모습과 많이 다릅니다\n펌웨어, pcb 설계 등등 역할이 많이 세분화 되어 있고 그 중 컴덕인거랑은 전혀 관계가 없고\n유사/유관 분야도 아닙니다. 거기에 비전공자가 입문하기엔 허들도 높아요.', 'createAt': '3일전'}, {'user': '제운', 'content': '1.하드웨어도 캐드쓰면서 회로설계하는 분야가있고, fpga가 있고 임베디드가 있고 종류가 많습니다.\n그냥 컴퓨터 조립해본 수준이면 소프트웨어가세요. 조립만 하는수준이면 컴닥터밖에 못합니다.\n정보보안도 종류가 많지만 일반적인 수준의 보안업계는 개발 경력 있는사람을 선호합니다.\n우리나 보안업계는 매우 협소하고 기업도 몇 없습니다.\n본인이 사용하는 보안소프트웨어중 유료로 쓰는게 있는지만 따져봐도요.', 'createAt': '3일전'}, {'user': 'MadMango', 'content': '정보보안이 임금 대비 기술 난이도와 허들이 많이 높은 분야인 걸로 알아요\n전공자들도 대부분 웹/전산 중에 고민하지 보안은 정말 좋아해야 갑니다 대학원도 많이 가고요', 'createAt': '3일전'}, {'user': 'manijang2.', 'content': '컴덕후하고 개발 및 보안하고 분야가 달라요. 어떤 느낌이야면\n내가 낙서 좋아한다고 그림 그리는 쪽으로 가는 것과 같다고 생각하면 됩니다.', 'createAt': '3일전'}, {'user': 'hswdreamer', 'content': '1. 하드웨어vs소프트웨어\n 말씀하신 수준의 하드웨어는 전망이 없습니다.\nPC 시장은 사양 산업이니까요.\n\n2. 정보보안 전망 좋을까요?\n보안은 고소득은 못해도 시장은 안정적입니다.\n 3. 정보보안에 대해서 정보 좀...\n보안도 분야가 워낙 넓어서\n네트워크, 시스템, 관제..\n하드웨어 좋아하면 네트워크 보안쪽 공부해서 도전해 보심이 어떨까 싶네요.', 'createAt': '3일전'}, {'user': '달고양이', 'content': '제가 게임덕후인데 덕질과 직업은 확실히 달랐습니다.\n자신이 업으로 삼을 정도면 그만큼 더 조사해보시는 것이 좋겠습니다.\n지금은 다른 분야에서 일하고 있네요..\n덕업일치는 자신이 사업하는게 가장 좋고 (가장 어려움)\n차선으로는 업에서 덕을 뺀 후 경력을 최대한 쌓은 후 영향력이 생겼을 때 덕을 더하는 방법이 있습니다.\n회사와 자신이 추구하는 방향이 맞다면 좋겠지만 그런 회사 찾는거 쉽지 않습니다.', 'createAt': '3일전'}]"
okky,lifeStory,자바킬러,AI는 러버덕 디버거라고 봅니다,"AI 에게 지금 버그난 상황과 에러메시지 내가 원하는 방향 잘 썰 풀면 최대한 쓸만한 방법 잘 도출해 주더군요.
AI가 못 푼다?
스택오버플로에도 없는 초난해한 문제이거나
내가 만든 코드 아키텍처가 근본적으로 노답인 겁니다.

고무오리에게 설명이 가능해야 문제도 해결 가능",0,3일 전,383,1,"[{'user': 'leon808', 'content': '최근에 개발할 때 방대한 양의 오픈 소스 가이드, 기술 문서를 뒤져야할 때가 있었는데\nAI 한테 물어서 봐야될 곳 좁히는 용도로는 쏠쏠하더라고요\n물론 여전히 환각은 심해서 서치 GPT 나 학습 시점까지 고려해도 실수하면 안 되는\n명백한 한두줄의 문서 레퍼런스조차도 헛소리 뱉는다던가\n엉뚱한 답변 코드들이 많았는지 스레딩에서 개소리한다든가는 무시했어야 하지만\no3 에서 더 개선됐으면 좋겠네요\n교차 검증 또는 무시를 그만둬도 되는 날이 진짜 혁명일거 같습니다', 'createAt': '3일전'}, {'user': '한안아', 'content': 'ai 가 못 풀면 내가 잘의를 잘 못 한게 아닌지 고민해봐야 함', 'createAt': '3일전'}]"
