category,tag,user,title,content,imgSrc,createAt,viewCount,likeCount,postReplyLists
okky,lifeStory,kenu,"`윈도우 개발환경 셋업` 기획은 10월에 했는데, 완성하기 힘드네요.","mac만 주로 10년 넘게 사용하다 보니
윈도우 개발환경의 한계가 너무 어려워서 만들고 있는데,
정말 쉽지 않네요. ㅠㅠ
https://bit.ly/windevset


이렇게 살고 있습니다.",https://file.okky.kr/images/1734951957078.png,2일 전,265,1,"[{'user': 'kenu · 작성자', 'content': 'https://www.youtube.com/playlist?list=PLDMPhWe3CfpalmlWid3oFmUyk24W9qhtv\n리허설 영상입니다.', 'createAt': '2일전'}, {'user': '캐티', 'content': 'Visual Studio, Code 2개만 사용중이어요. git이 확장으로 제공되어도 모두 포터블을 사용하고 링크 페이지에 둘째 문단에서 받을 수 있쩌. 이케 하는 이유는 윈도우는 설치된 프로그램이 많은데 컴터가 터지면 지나치게 난처해지빈다. WinSCP 같은 것들이 포터블 어플로 제공되어요. 그 외 어플들은 portableapps를 사용하면 좋아요.\n[1] Git - Downloading Package\n여담으로 아이폰 앱을 개발하려면 맥 미니라도 구매하여야 할 것 같지 않나요.', 'createAt': '2일전'}, {'user': 'カワウソ', 'content': '윈도우는 개발하면서도 문제가 많아요.', 'createAt': '2일전'}, {'user': '일랑이유리', 'content': '맥의 가격이 진입장벽 ㅠ', 'createAt': '1일전'}, {'user': '바보쿠우', 'content': 'c# 만세', 'createAt': '1일전'}]"
okky,lifeStory,leon808,다들 크리스마스 즈음에 무얼 하시나요?,"저는 1n년째 늘 하던대로 고향에 돌아가
아버지 일 도와 짐 나르고 포터 몰고
어머니 일 도와 피자 만들러 갑니다

이번엔 원래부터 고향에 있는게 아니고
대학이 아닌 연차를 낸 현 개발자
전 피자 외 자영업 장인으로 돌아가네요

그나마 최근 몇년간 좋아진건
제가 피자 만들고 주문 받고 배달하는거 다 할 필요 없이
배달 대행을 맡기면 된다인거에요

오키 여러분은 어떻게 보내시나요? 궁금합니다",0,2일 전,388,2,"[{'user': 'kenu', 'content': '저는 간만에 가족모임으로 25일 연극 예매했어요.\n2호선 세입자 연극\n\n\n연극 백만년만에 가려고 하니, 인당 5만원이네요.\n150석 정도 되는데, 인건비 생각하면, 나름 수긍이 됩니다.\n15년 뒤에는 AI 로봇이 연극하는 시대가 될 것인가 쫌 거시기 합니다.', 'createAt': '2일전'}, {'user': '오키도키나이키', 'content': '집에서 푹 쉴 예정입니다!', 'createAt': '2일전'}, {'user': 'Woooo', 'content': '제 집에서 회사사람들이랑 홈파티하고 저녁먹고 인생네컷찍고 술마시러 갈 예정이에요.', 'createAt': '1일전'}, {'user': '조금만 기다려줘', 'content': '그냥 공휴일일뿐 ... 세상을 왕따시킨다!', 'createAt': '1일전'}, {'user': 'dk100', 'content': '집에서 간단히 요리 해 먹을 예정입니다. 아빠가 스테이크 만드는 날 ㅎㅎ', 'createAt': '1일전'}]"
okky,lifeStory,정규분포,TIL 노상범대표님이 OKKY 대표라는 사실,"sbroh님이 쓰는 글들이 계속 베스트에 넘어가서 의아해 했는데, 다 이유가 있었더라고요. 아님 나만 몰랐나 봅니다.
개인 페북을 가보니 정치얘기를 즐겨하시는 것 같은데, okky라는 플렛폼은 남용해서 정치판 dumpster fire로 만들지 않으시는 것도 대단한거 같습니다. 나 어렸을 때는 그렇게 하기 어려웠을 거고, 심지어 점잖은 유명 유튜버들도 그런 자제를 못하는 모습이 가끔 보이는데 말이죠.
okky라는 장수 커뮤니티의 규모가 아직도 많이 커지지 않은 것을 보면 (뭐 커뮤니티 자체도 딱히 큰 장점이 없는 것일 수도 있지만), 한국이 확실히 IT 산업 불모지라는 사실이 아닌 듯도 합니다? 다른 개발 관련 커뮤니티도 보면 장수는 해도 트래픽이 없어서 파리날리는 분위기가 많아요. 열정이 넘치는 분들은 가끔씩 보이는데, 사람들이 없어서 다들 어색하게 떠나는 안타까운 현실. 실력 좀 있으면 대부분 영어권 커뮤니티로 떠나나 봅니다.
거의 20년 가까이 포기하실 법도 한데 계속 유지하시는거 대단하십니다. 한국 문화가 더 발전해서 okky 같은 커뮤니티의 규모가 커지는 날이 오겠죠?

일과 시작하기 전에 몸풀기로 open letter를 올려드림.",0,2일 전,775,4,"[{'user': '장플', 'content': '노상범 대표님이 okky 대표라는 사실은 저같이 올드 유저들은 다 아는 사실이죠.', 'createAt': '2일전'}, {'user': 'kenu', 'content': '2013년에 대표님으로 모셨는데, 10년이 지나도 사이트가 조금씩 천천히 존버해서 매우 감사한 1인입니다.\n한국에 필요한 IT정책은? (개발자 관점 및 국민 관점)\n이 글도 반응이 꽤 많았습니다.', 'createAt': '2일전'}, {'user': '애매', 'content': '커뮤니티 생태계를 보면.. okky정도면 꽤나 롱런하고 트래픽도 많은편이라고 생각되는데', 'createAt': '2일전'}]"
okky,lifeStory,カワウソ,커스터마이즈 지옥,"자꾸 바꾼다.
결과도 안보고 바꾼다.
바꾸는 와중에 바꾼다.
그럴리 없다는 것으로 다시 바꾼다.
고객 만나면 계약도 안했는데 바꾼다.
일단 다 된다고 이야기하고 바꾼다.
묶어서 팔려고 서로 다른 제품을 엮기 위해 바꾼다.
당연히 기획은 없다. 그러니 쉽게 바꾼다.

그렇게 바꾼 결과는...",0,2일 전,400,2,"[{'user': '키리링', 'content': '개발에 ㄱ도 모르는 사람이 위에 있으면 나오는 결과', 'createAt': '2일전'}, {'user': '프레이야', 'content': '결과는 지옥이네여. ㅠㅠ\n지옥길 막는 방법이 있음 좋겠네여', 'createAt': '2일전'}, {'user': 'Unknown_', 'content': 'ㅋㅋㅋㅋ 고객사에서 해달라는거 다해주라고 오더 받아서 다해줬더니,\n납품하고나서 왜케 개판을 쳐놨냐고 뭐라 하던 곳도 있었음 ㅋㅋㅋㅋㅋ 완고하게 해달라매...', 'createAt': '1일전'}]"
okky,lifeStory,0202룰ㄹ,백엔드 강의 추천좀 부탁드려용,1년차 개발자 입니다. 강의 들으면서 스프링 공부를 더 하고싶은데 어떤 강의가 좋을까요? 강의 말고 다른거 추천해주셔도 좋습니닷,0,2일 전,379,0,"[{'user': 'onimusha', 'content': 'https://okdevtv.com/', 'createAt': '2일전'}, {'user': 'qwer1232', 'content': '영한이형 ㄱ', 'createAt': '2일전'}]"
okky,lifeStory,키리링,게으름은 가장 큰 단점이고 실행력이 가장 큰 재능인거 같네요.,"개발을 처음 배울 때는 저만의 서비스, 저만의 어플, 저만의 솔루션을 만들어서 회사에 소속되지 않고 돈을 벌고 싶다 생각 했습니다.

어느 덧 3년 차가 지나니 이제 회사에서 프로젝트를 주면 어플, 백엔드까지 혼자 만들 수준이 되었습니다.
백엔드는 주가 아니지만 그래도 40만 사용자를 커버하게 되었고 간단한 웹 사이트도 만들 수 있게 되었습니다.
주 개발이 어플이니 어플은 뭐 더 수월하고요.

하지만 정작 이렇게 실력을 키우고 보니... 왠만한건 만들 수 있겠다는 오만한 생각 때문인지 무의식적으로 그런 생각이 들더군요.
'언제든 할 수 있으니 나중에 하자 귀찮다'

퇴근하면 보통 1주일에 3번은 2시간씩 헬스를 합니다. 그러면 남은 시간이 있지만 그 시간을 쓰지 않고 쉬기만 합니다.
나태해졌고 번아웃이 온거죠.
어찌저찌 이겨내고 혼자 서비스 해보려고 만든 어플은 어느덧 완성 80%에서 2달 정도 멈춰있습니다.

제게는 게으름이라는 벽에 실행력이 많이 부족한거 같습니다.
어쩌면 누군가가 닥달하지 않아서 안하는 것도 맞는 것 같습니다.
시험 준비도 시험 날짜가 다가오면 집중력이 엄청 올랐거든요. 그런데 개인 프로젝트는 기한이 없으니... 의욕이 안나나 봅니다.

혹시 개인 사업을 통해서 돈을 벌고 계신 개발자 분이 있을까요? 이 난관을 어떻게 이겨내면 좋을지 조언 부탁드립니다.",0,2일 전,917,7,"[{'user': '몰랑토끼', 'content': '회사에서의 내 모습은 부캐릭터이고, 회사밖의 모습을 본캐릭터 라고 생각해서 교체한다.\n실행력이 아닌 호기심을 가진다. 어린애들 호기심만큼 무서운게 없는것처럼 호기심을 가져서 해본다.', 'createAt': '2일전'}, {'user': 'qwer1232', 'content': '동감입니다', 'createAt': '2일전'}, {'user': '달고양이', 'content': '전 제 게으름이 나름 장점이라고 생각하는데요 ㅎㅎ\n물론 게으른 자신에게 자기비판이 너무 심해서 우울증까지 온 적도 있지만\n극복해보니 게을렀기에 조금 더 편하고자하는 아이디어들이 나온다고 생각합니다\n자기 합리화이긴 한데 우울증 걸리는 것보다 100배 낫다고 생각합니다.', 'createAt': '2일전'}, {'user': '캐티', 'content': '일찍 일어나세요. 운동 전에 커피를 마시면 효과가 좋다고 하여요. 집중을 오래 하면 좋고 작업을 할 때는 주로 신속하게 하면 좋스빈다. 타자 속도가 빠를 수록 성과가 좋고요. 컴퓨터가 빨라도 좋아요. 한 가지만 좋다고 하더라도 효과가 있겠지만 모두 좋으면 아주 좋아요.', 'createAt': '2일전'}, {'user': 'ppythonman', 'content': '정신적인 에너지라고해서 무한정 솟아 나는건 아닙니다.\n적절히 관리 하지 않으면 금방 고갈되요.\n\n쉰다는게 유투브 보고 게임하고 그러시는 중이면 정신적인 에너지 쓰는 중인겁니다.\n본인수준에 맞는 독서나, 명상, 산책같은걸로 머리 피로를 푸셔야\n아마 다른일을 할 의욕이 나실겁니다.\n\n그리고 인지한데로 마감기한도 있는편이 낫습니다.\n스케줄을 만들어서 이때까진 머라도 끝나 있어야 한다는 그런게 있어야 할꺼에요', 'createAt': '2일전'}, {'user': '코가더', 'content': '예전 도서관 벽에 걸린 문구\n\n-- 부처\n백만의 병사를 이긴 장군보다\n자기자신을 이긴 자가 더 위대하다!!!', 'createAt': '2일전'}, {'user': '옴뇸뇸뇸', 'content': '이야 그 정도면 엄청 대단하신데요.... 집에 오면 나가기 힘들던데 운동도 다니시고..', 'createAt': '1일전'}]"
okky,lifeStory,sbroh,왜 대한민국 SI는 바뀌지 않을까?,"왜 대한민국 SI는 바뀌지 않을까?
40년 전 이력카드 양식을 지금도 쓰고 있을까?
1980년대 초반 삼성SDS에서 개발자 인력관리를 위해 만든 것이 지금도 돌아다니고 있는 이력카드.
Skill Inventory에 지금도 '기종', '산업/응용', '통신' 같은 문구가 있는 양식을 그대로 사용.
저게 뭔 말인지 이해는 할까?


왜 지금도 초급/중급/고급/특급의 ‘등급제’를 사용하고 있을까?
실력 따라 구분하는 건 이해 하겠는데,
'학사 5년차' 같은 구분이 대체 말이 된다고 생각하는 건지.


10년 전이나 지금이나 '단가'는 왜 그대로일까?
그동안 아파트값은 얼마가 올랐으며 밥값은 얼마가 올랐는데... 끽해봐야 10% 남짓?


갑을병정무기경신임계, 하도급은 왜 없어지지 않는 걸까?
한국 시장의 특성 상 갑을병정이 없어지긴 어렵겠지만
민간SI시장에서 그 이하로 내려가는 건 정말 문제 아닌지.
공공에서는 오히려 하도급 제한을 걸어둬서 꽤 개선이 된 것 같긴 한데...


왜 아직도 제안서는 10부 인쇄를 해가야 하는 걸까?
인쇄는 '갑'님들이 좀 하시지... 제안비도 안주면서.
거기에 2024년에 아직도 CD 제출하라고 하는 데가 있다.
전세계에 이러고 있는 나라가 몇개나 있는지 궁금.


코드의 저작권은 왜 지금도 ‘갑’이 갖는 걸까?
유지보수를 위해서라면 '갑'은 사용권만 갖고 있어도 충분한 거 아닌가.
아니면 공동소유라도.


왜 ‘갑’과 ‘을’이라는 표현은 없어지지 않는 걸까?
'공급자', '수급자'라고 쓸 수도 있고, '고객사''와 '수행사'라고 쓸 수도 있는데,
굳이 '갑','을'로 꼭 써야 하는지.
아주 뿌리깊은 위계적 계약 문화라 생각.


사실은 공공 쪽보다 오히려 민간 쪽 문제가 요새는 더 커 보임.
공공 쪽은 (Public Sector) 2013-2016년 경 당시 미래창조과학부 소프트웨어정책국 쪽에 훌륭한 분이 계셔서 많은 변화를 끌어냈음.
지금은 정부가 개발자들한테 뭐 해줄 게 별로 없음.
오히려 민간 쪽이 (Private Sector) 문제 아닐까...라고 생각.
SI가 바뀌어야 SI에 대한 인식이 바뀌고,
SI에 대한 인식이 바뀌어야 개발자가 살고,
개발자가 살아야 나라가 산다고 믿는 1인.
누가 바꿔주지 않음.
개발자들이 스스로 바꿔야 함.",0,2일 전,2.0k,26,"[{'user': 'HJOW', 'content': '개발자는 저걸 바꿀 능력이 없습니다.\n개발자 및 개발회사에 수주를 맡기는 고객사들이 바뀌어야 해결될 문제입니다.\n특히나 이건 ""과일가게"" 현상이 벌어지는 대표적인 사례죠.\n\n\n과일가게 현상은 딱히 이름붙은 게 없어서 제가 그냥 부르는 건데\n더 지니어스에서 나온 과일가게 게임이름이 유래고\n\n\n다른사람 모두 5000원을 제시했는데\n한명이 4000원을 제시하면, 그 사람이 독식하고 다른사람은 쪽박\n\n\n이라는 현상입니다.\n즉 개발자와 개발회사들이 바꾸려면 전원이 다 합심해서 바꿔야 하는데, 그게 근본적으로 불가능하다는 거죠. 단 1명이 배신하면 끝나니까요.\n\n\n고로 고객사들이 바뀌어야 한다는 겁니다.', 'createAt': '2일전'}, {'user': '더미', 'content': '둘다 해봤는데 공공이 더 개판입니다.', 'createAt': '2일전'}, {'user': 'MadMango', 'content': '공공과 국산 SI는 대체 어떤 곳일까..', 'createAt': '2일전'}, {'user': 'n = n + 1', 'content': '당장은 못바꾸더라도 바꾸는 방법은....\n정책을 누가 만들고 시행하는지 생각해보면 정책을 만드는\n사람들을 잘 뽑는 것도 하나의 방법이라 봅니다.', 'createAt': '2일전'}, {'user': '김포포', 'content': '좋은 말씀이시고, 자주 언급되어야 할 문제이고, 근데 가장 중요한게 하나 빠진듯\n\n기간을 정하고 그 기간이 끝나고 아직 안끝났다는 핑계로 공짜로 부려먹으면 안됨\n기간이 늘어나는것을 절대적으로 갑이 추가비용으로 책임져야하는 문화\n\n이렇게 되면 굉장히 많은 부작용이 자연스럽게 없어집니다.\n이건 갑,을이 바꾸긴 힘들어보이고.. 먼가 법,행정력이 동원되야 한다는 모호한 생각만 들 뿐 이네요', 'createAt': '2일전'}, {'user': '흠냥흠냥', 'content': '저걸 어떻게 개발자가 바꾸죠?\n시장의 구조적 문제를 개인이 바꿀 수 없음.', 'createAt': '2일전'}, {'user': '천사와악마', 'content': '개발자가 할 수 있는 영역은\n계약에 없는 부당한 요구를 거부하고,\n뻥튀기 범죄(사문서 위조)에 공범이 되지 않는거\n\n이것만 해도 할 도리는 다 한거 아닐까요?\n나머진 시스템이 해결해줘야지. 가장 밑단에서 이 사태를 해결하려면 레볼루숑밖에 없습니다 ㅋ', 'createAt': '2일전'}, {'user': 'heloow', 'content': 'SI 구조나 거기서 일하는 개발자나\n변화를 굉장히 싫어하더라고요\n그리고 공부안해도 평생 살수있다고 하더라구요', 'createAt': '2일전'}, {'user': 'onimusha', 'content': '스킬 인벤토리 첫 행에 추억의 환장할 기술 조합 들어있네요..\n홍길동 선배님께 존경과 위로의 박수를 보냅니다.', 'createAt': '2일전'}, {'user': '몰랑토끼', 'content': '실력? 알빠노\n연차로만따짐 ㅋㅋㅋㅋㅋㅋ', 'createAt': '2일전'}, {'user': '월급은나의빛', 'content': '다른 나라 SI 프로젝트는 다르게 굴러갈까요? 하도급의 폐단이 없는 나라와의 차이는 뭘까요?', 'createAt': '2일전'}, {'user': '프레이야', 'content': '좋은 생각할 거리를 주셔서\n잠시 생각해보니\n수요와 공급이 맞으니 바뀔 필요가 없을것 같기도 하네여.\n저스킬양식과 등급제 단가 하도급형태로 수요자 공급자가 50프로이상이 만족하니 바꿀 필요가 없는듯여.\n결국은 한축인 개발자가 바뀌어야 하는데 난 잘못한게 없으니 바꿀게 없다고 하니 그냥 가는듯여..', 'createAt': '2일전'}, {'user': '코가더', 'content': '키는 누가 쥐고 있을까요??\n회사들이 돈주면 IT 시스템 만들어준다..\n거기에 정치.영업 밥그릇 싸움도 치열할 거고~~~\n\n요샌 경기가 안 좋고 AI도 나오고 취직이 제일 우선인 시대라...\n퀄러티를 요구할떄가 아니라는 개인적 의견입니다.\n\n말씀하신게 개발자의 좋은건 맞습니다.\n언제면 저런 세상이 올지~~~~', 'createAt': '2일전'}, {'user': 'Bugfix', 'content': '아파트 값은 비정상적인 케이스라 인건비 케이스랑 연동하는건 잘못된거 같습니다.', 'createAt': '2일전'}, {'user': '꾸우까', 'content': '건물은 시스템에 비유하는게맞고\n인력장사는 노래부르고 춤추는 아이돌들도 저작권이 없는것과 소속사에서 준비를해야지 무대가 있는것과같죠\n팝핀현준이나 정지훈처럼 업종내에 탑클래스있는사람들은 자기맘대로 다니고 자기것을 할수있는거고요', 'createAt': '2일전'}, {'user': 'kenu', 'content': '페북 공유하기 하니 멋있는데요. 헐', 'createAt': '2일전'}, {'user': '개막장', 'content': '그냥 씹찐따 새끼들이 많아서요\nSI하면서 사무실에 있었던 인원 다 합치면 대충 3,000명은 넘게 있었던거 같은데\n잘못된거에 대해서 잘못됬다고 말하는 인간이 나포함 3명밖에 없었음\n수행사, 고객사, PL, PM한테 한마디도 못함\n담배피면서 징징징 술처먹으면서 징징징 에휴 병신새끼들\n그냥 병신들이 대부분이어서 안바뀌는 겁니다', 'createAt': '2일전'}, {'user': '컴포지트', 'content': '개발자가 할 수 있는 거 다들 언급했죠. 거부하는 거.\n유명한 낙농업체 불매운동 하듯이 말입니다.\n수요 없는 공급 없듯, 공급 없이 수요도 없죠.\n\n근데, 뭐 몇몇분들 다 이미 지적했어요.\n불합리한 조건은 거부해야 하는데, 거부를 안해요.\n지금 불황 상황 보셨죠? 특히 공공. 물론 민간은 안뽑니 공공은 이때다 싶어서 고급을 중급단가로, 심지어 초급단가로 낮춰도 들어갑니다.\n심지어 경쟁율까지 있어요.\n이러니 어떻게 나아지겠습니까.\n특히, IT 업계 기술 트랜드에 도태되어 SI/SM 말고는 갈 곳 없는 개발자들, 나이제한 때문에 제약이 많은 개발자들,\n특히 이들 덕분에 사라질 수가 없어요.\n그래도 아쉬울 거 없는 개발자들은 안 갑니다.\n요즘 핫하다고 자자한 리액트 웹 앱을 만드는데 통상 6개월 분량을 1개월 안에 하라고 하면 누가 가요?\n저도 IT라도 잘 구축한 좋소기업 안에서 몸담그는 게 낫지 공공같은 지옥같은 외주는 죽어도 안가요.\n자격이 안돼서? 아뇨, 학력 딸려서도 아뇨. 그냥 불합리한 조건이라서 안가는 겁니다.\n한두번 당하지 다시는 당하고 싶지 않아요. 거기 몸담그다 병원 신세 지고 싶지도 않고요.\n차라리 이런 불황에 돈 적게줘도 밸런스 있는 직장 구하겠습니다. 아, 저같은 경우 구했네요.', 'createAt': '2일전'}, {'user': '초무쿤', 'content': '비단 SI뿐만 아니라 우리니라 산업구조 문제인듯 합니다.(SI는 그나마 나은걸지도..)', 'createAt': '2일전'}, {'user': 'twinings', 'content': 'GPT의 의견 : 결론적으로, 대한민국 SI 산업이 바뀌려면 고객사, 개발자, 정부 모두가 역할을 해야 합니다. 다만 가장 핵심적인 변화는 고객사의 인식 전환에서 시작해야 한다고 생각합니다. SI를 단순한 비용 절감 도구가 아니라, 비즈니스 성공의 파트너로 보는 시각이 자리 잡혀야죠.\n개발자들의 힘만으로는 어려운 일이지만, 점진적인 변화는 가능하다고 믿습니다. SI의 구조적 문제가 개선되면, 개발자들이 더 나은 환경에서 일할 수 있고, 궁극적으로 산업 전체의 성장이 이루어질 것입니다.\n\n제 의견 : 되겠냐 ?\n고객사에서 돈 더주면 그게 개발자 주머니로 꽂힐줄 아는 대가리가 꽃밭인 사람도 있네', 'createAt': '1일전'}, {'user': 'younghoo', 'content': '트럭운전기사들은 잘 뭉치는데 왜? IT개발자들은 잘 뭉치지 못할까요? 생각해보면 답은 금방 나옵니다.', 'createAt': '1일전'}, {'user': '그냥회사원이좋잖아요', 'content': '잘 만들어놓아서, 이력카드 말고도 산업에서 잘 만들어둔 양식이 오래가는거 같아요.\n회사에서 신입사원 뽑을때도 비슷해보입니다. 유학파/인서울/고졸 실력을 빠르게 판단할수있는 지표? 그렇다면 개발실력 검증? 불가능하죠, 고객사는 개발자 실력 관심없고 수행사도 잘하는 개발자보다 이윤을 더 추구하기 때문일거라 생각합니다.\n공급과 수요의 원칙은 어느때에도 불변하죠.\n책임회피 및 이윤 남기는 것\n저런곳보다 안그런곳이 더 많지 않나요?\n코드를 갑이 안가져가면 누가 소유하나요? 냉장고 구매해도, 생산자가 소유하나요? 개발자가 소유하면 As받을때 개발자가 얼마를 달라고 하던 줘야하는데, 비용 마음에 안들면, 다른개발자에게 as맡길수 있어야죠.\n갑/을이 표기가 편합니다. 대체하기 어려운 단어 같습니다.', 'createAt': '1일전'}, {'user': '흰꿈둘', 'content': '축협만 봐도 우리나라는\n실력보단 인맥 부정부패가 많아서', 'createAt': '약 15시간전'}]"
okky,lifeStory,길가다주웠어,것힙.jpg,from reddit,https://file.okky.kr/images/1734925027405.png,3일 전,638,3,"[{'user': '월급은나의빛', 'content': '도메인 등록자가 누군지 보려고 했더니 whoistrustee.com 으로 명의가 가려져 있네요.', 'createAt': '3일전'}, {'user': 'n = n + 1', 'content': '거기 들어가면 무언가 음흉한게 있을듯하네요', 'createAt': '2일전'}, {'user': 'leon808', 'content': '이걸 보니 윈도우 오타 교정 생각나네요\n저는 바탕화면 아이콘, 바로가기 안 두고 항상 윈도우 키를 눌러 원하는걸 입력하는 편인데요\n예를 들어 chrome 같은걸 cheime 등으로 어느 정도 오타를 내거나 한글로 초개ㅡ 등\n심지어 한글로 오타를 쳐도 윈도우는 자연스럽게 연결해주는게 정말 편합니다', 'createAt': '2일전'}]"
