category,tag,user,title,content,imgSrc,createAt,viewCount,likeCount,postReplyLists
okky,lifeStory,ICKOM,개발자로 실력이 없으면 잡일을 많이 주는건가요..?,"안녕하세요 선배님들! 아래 글을 작성했던 경력직으로 이직한 사람? 입니다..!
https://okky.kr/articles/1518177

저 글을 작성하고 벌써 2개월이 흘러서 3개월을 채웠네요.. 시간 참 빠릅니다.. 저 글을 쓰고 낮에는 잡일 하고 저녁엔 코드를 보면서 시간을 보냈습니다. 오늘도 야근하면서 코드 보다가 현타가 와서 이렇게 글을 씁니다.. 잡일 리스트를 적어보자면,,
1. 스티커 라벨 제작해서 기기에 하나씩 다 붙이기(기구 도안? 을 받아서 라벨 디자인 후 출력해서 자른뒤에 부였습니다.)
2. 회사 내 테스트 제품 하나씩 안테나 해제하기 & 조립하기
3. 분리수거 하기(이건 격주로 제가 합니다.)
4. LED 고무링 끼우기(LED 몇백개를 하나하나 고무링? 같은걸 껴줍니다.)
5... 택배 보내기 등등등
업무시간에 계속 불려다니고 한분이 아니라 여러분이 이것저것 주시고 1,2,4번같은 경우는 몇개, 몇십개가 아니라 400~800개정도 수량을 주십니다. 그래도 어찌저찌 야근을 하면서 코드 분석을 하고 블록다이어그램을 그리고 있는데 지나가시면서 ""그렇게 정리해도 이해하기 어려울텐데ㅎㅎ"" 하시면서 지나가는데 멘탈이 흔들리더라구여.. 전 댓글에서 말해주신대로 선임님분들한테 궁금한 부분을 물어봐도 코드 보면 된다 하고 더이상 피드백이 없습니다.
이번엔 한번 사용해봤던 툴이 있었는데(요것도 노가다 하면서 스치듯 배웠습니다..ㅎ) 이 툴 기능들을 정리해서 생산 공장으로 혼자 2~3일정도 출근해서 교육을 하라고 요청 받았습니다.
댓글들을 보면서 기술도 좋고 매출도 좋으니 어떤식으로든 적응하면서 남아볼려는데 3개월째 이렇게 회사를 다니니 의욕도 없고 뭘 하는지 모르겠습니다.. 몇개는 막내로 그냥 그러려니 하지만 라벨 디자인부터 제작 이런 걸로 시간을 보내는게 너무 많다보니 현타가 오네요..
이정도면 제가 실력이 없어서 잡일을 시키는건지 궁금하기도 합니다. 다른 선배님들의 생각은 어떤지 궁금해서 이렇게 긴 글을 작성했습니다. 긴 글 읽어주신 모든 분들께 정말 감사합니다.",0,2일 전,1.4k,1,"[{'user': '맵달짜', 'content': '아니 그냥 진짜 개잡부 취급인데 왜 다니시죠?? 매출 좋고 기술력 좋은 회사 맞나요? 개발자로 들어간거 맞아요?', 'createAt': '2일전'}, {'user': '캐티', 'content': '교수님을 불러다 놓고 사칙 연산을 해 달라 이럼 잘못되었지 않겠나요. 지원자가 연봉을 지나치게 낮게 부른 것 같스빈다. 앞으로는 8000+부터 불러요.', 'createAt': '2일전'}, {'user': '월급은나의빛', 'content': '저도 대기업 HW개발 담당으로 2년간 보드에 칩 붙이면서 너무 배우는 게 없다고 생각하고 SW개발 하겠다고 뛰쳐 나왔습니다. 윗사람들이 무시했다기 보다는 조직 구성이 그럴 수밖에 없었던 것 같습니다. 아날로그 회로를 도면과 지시서 그대로 따르면서 조금씩 배워나가는 방식에 익숙한 분들이었는데, 디지털 시대로 기술이 많이 바뀌어서 그분들이 가르칠 수 있는 것이 적었죠. 좋은 분들이었지만, 제 성장을 끌어주기는 힘든 환경이었습니다.\n퇴사하고 나서 IMF로 무지 고생했는데, 그래도 잘 나왔다고 생각합니다.', 'createAt': '2일전'}, {'user': '초무쿤', 'content': '좋좋소 아님니까?\n저도 첨에는 좋좋소에서 화장실 청소부터 ㅋㅋ\n전 그래도 사람들은 좋아서 1년 채우고 런했습니다만\n그것도 그지같으면 바로 런이고\n괜찮으면 2-3개월 아까우니 경력 채우면서 경기좀 좋아질때까지 그냉 한번 다냐보는것도 ㅎㅎ (지금 나오먄 살얼음판이라..)', 'createAt': '2일전'}, {'user': '방황하는젊은이', 'content': '이직이 답입니다.', 'createAt': '2일전'}, {'user': 'm.koo.kr', 'content': '수습기간 보통 3개월 정도는 잡으니까? 수습기간 채우기 전이시면?\n다른 직장 구하세요! 애초에 개발자로 채용해서 시킬 업무자체가 아닙니다\n\n하드웨어, 소프트웨어 다 하는 중소기업에서도?\n소프트웨어 개발자한테! 조립/남땝 같은 거? 안 시킵니다!\n\n숙련자가해도? 1~2% 정도 불량이 나오는 데?\n비 숙련자가 납땜한 거 같으면? 전부 폐기일 겁니다 ㄷㄷ\n\n생산 딸릴 때는 공장으로 돌리고? 생산 여유 있으면 개발로 조지고?\n그런 포지션일 가능성이 높아 보입니다 ㅠㅠ\n\nc# 백엔드 개발자로 뽑아놓고, 웹개발을 시켰던 회사는 경험해 봤지만..\n개발자로 뽑아놓고? 공돌이로 굴리는 데는 처음보네요 ㄷㄷ', 'createAt': '2일전'}, {'user': 'leon808', 'content': '돈은 제대로 주긴 주나요...?', 'createAt': '2일전'}, {'user': 'Woooo', 'content': '잡일이라고 해서 남이 개발해놓은거 배포하는 등의 뒤치다꺼리인줄 알았는데 아예 개발하고 상관없는 더 심한 잡일이었네요.. 대우가 너무합니다!', 'createAt': '1일전'}, {'user': '달고양이', 'content': '잡일이 아니라 영역이 다른데요... 포지션 배분 제대로 안되면 빠른 런 추천드립니다.', 'createAt': '1일전'}, {'user': 'Lzlzlzzz', 'content': '저런거 하시다보면 이직 못합니다.\n이직은 철저히 ""이전 직장에서 어떤 성과를 냈는가""를 보는데, 저런거면....서류나 면접에 할말이 없을겁니다..', 'createAt': '1일전'}, {'user': 'libedi', 'content': '신입으로 잡일을 할 수는 있는데, 그게 주 업무가 되면 안됩니다.\n3개월이 지났으니 담당 사수에게 언제쯤 어떤 개발을 할 수 있게 되는지 문의해보시고, 계획이 없어 보이거나 무시, 면박등을 한다면 빠른 이직을 하시길 바랍니다.', 'createAt': '1일전'}, {'user': '바보쿠우', 'content': '개발자로 취업하신건 맞는건가요??? 개발 일이 없어서 저런 일을 시키는건가요? 아니면 개발 일이 있는데도 저런 일을 시키나요??', 'createAt': '1일전'}, {'user': 'The Lowly', 'content': '안바쁜 사람을 먼저 시키지 않을까요..\n중요도가 낮은 파트이면 가능할거 같아요', 'createAt': '1일전'}, {'user': 'KJS2020', 'content': '개발자로 실력이 없으면 잡일을 많이 주긴합니다.\n거기를 왜 계속 다니고 있나요?', 'createAt': '1일전'}, {'user': '자린이_개발자', 'content': '딱 봐도 뭐 하나 시키기에는 애매하고, 본인들 개발하는거 관련되서 설명해주고 해봐라 하고 하는게... 귀찮은거 같네요.. 내가 해야지... 누굴 시키나 마인드 + 쟤가 이거 하게 되면.. 내가 할게 없는데.. 등등\n\n4년차 개발자에게 그런 취급이면 런이 답입니다. 이제 3개월이시니..\n수습기간 회사 관련 공부 및 분위기 살펴봤을때... 답이 없는 회사라는 이유를 찾으시고,\n이직때 그런 이유때문에 나왔다고 하시면 됩니다.', 'createAt': '1일전'}, {'user': '스타이너', 'content': '인터넷에 떠 도는 좋좋쏘 의 대표적 특징..', 'createAt': '1일전'}, {'user': 'qwer1232', 'content': 'ㅜㅜㅜㅜㅜㅜㅜㅜㅜㅜㅜㅜ', 'createAt': '1일전'}, {'user': '토끼발', 'content': '실력없어서 그런건 아니고 막내라서 시키는거 같네요 안맞으시면 면담해보고 이직하셔야죠', 'createAt': '1일전'}]"
okky,lifeStory,캐티,유래가 학습되지 않은 ai,"iliililillililil 와 유사하게 작명된 아이디의 유래가 무엇일까
""iliililillililil"" 같은 아이디는 주로 반복되는 문자 패턴으로, 사용자가 기억하기 쉬운 독특한 형태를 만들기 위해 고안된 것일 수 있어요. 이런 스타일은 종종 개인의 취향이나 유머 감각을 반영하기도 합니다.
더 궁금한 점이 있나요? :)
iliililillililil 와 같은 아이디의 유래를 정확히 알기는 어렵지만, 보통 이런 유형의 아이디는 보안 강화 또는 특정한 패턴을 통해 쉽게 기억하기 위한 목적으로 사용되곤 합니다. 예를 들어, 소문자 L과 대문자 I가 섞여 있는 경우, 봇이나 해커의 자동화된 공격을 피하는 데 도움이 될 수 있습니다. 또한, 이런 패턴을 통해 독특하고 기억하기 쉬운 아이디를 만들려는 시도일 수도 있죠. 😊
혹시 아이디를 만들거나 변경하려는 계획이 있으신가요? 필요한 도움을 드릴 수 있어요!
여담으로 생각해 놓은 ai 구현 방식이 있는데 .. 돈이 앵간하게 들어가야 하여서 하기 참 어렵스빈다.",0,2일 전,227,0,"[{'user': '라이라', 'content': '긁어다가 메모장에 붙여넣고 폰트 바꾸면 보이지 않나요?', 'createAt': '2일전'}]"
okky,lifeStory,레오파파,플젝 서류검토 얼마나 걸리나,"ㅂㄷ방을 통해 연락을 받아 플젝 지원을 한 상태입니다
케바케겠지만, 보통 몇일만에 연락이 오나요?
물론, 서류 탈락인 경우 연락을 아예 안주는 경우도 있고,
프리 서류전형은 결과가 빨리 나오는 경우가 많았는데요
다른 분들은 어떤지 궁금합니다",0,2일 전,265,0,"[{'user': '꾸우까', 'content': '신규플젝 제안단계면 시작전이면 좀걸릴수도있고\n인력이 필요한경우면 금방요', 'createAt': '2일전'}, {'user': 'worldblue', 'content': '하루이틀안에 연락안오면 끝났다고 보시는게 90%이상', 'createAt': '2일전'}, {'user': 'ramisiel', 'content': '개네들은 그냥 급여ㅈ더\n낮은사람 서류를 사용함ㅋ', 'createAt': '1일전'}]"
