category,tag,user,title,content,imgSrc,createAt,viewCount,likeCount,postReplyLists
okky,lifeStory,개발자가아닌조립자,내가 다녀본 최악의 회사,"때는 2015년, 주니어 시절에 총 직원 50명 정도 되는 SI업체에 지원해서 합격했어요.
회사를 한 1년쯤 다녔을 때였나... 월급이 밀리기 시작했죠.
그때 제 월급은 세금 떼고 138만 원 정도였던 걸로 기억해요.
뭐... 그 당시에는 경력이나 쌓자는 생각으로, 적은 월급이라도 일단 다녔었는데,
그 적은 월급마저 밀리니까 생활이 안 되더라고요.
그래서 위에 있는 본부장님께 몇 번 얘기했죠.
그런데 돌아오는 대답은 ""지금 전 직원 월급이 밀리고 있는데, 네가 왜 징징거리냐""는 말뿐이었어요.
그래도 계속 얘기했더니 본부장이 저보고 ""대표한테 직접 얘기하라""고 하더군요.
그렇게 회사 다니면서 처음으로 대표실을 찾아가서 대표님을 대면했어요.
(그 전까지는 대표랑 인사조차 한 적이 없었죠.)
들어가서 인사하고, ""저는 어디어디 팀 누구입니다. 급여가 지금 두 달째 안 들어오고 있는데, 생활이 너무 어렵습니다.
월급이 도대체 언제 들어올 수 있는지 알고 싶습니다.""라고 물어봤죠.
그런데 대표가 한다는 소리가 가관이었어요.
""나는 내가 직접 당신을 뽑은 적이 없는데, 내가 왜 월급을 줘야 하죠?""라고 하더군요.
순간 벙쪄서 아무 말도 안 나오더라고요. 대꾸도 못 했습니다.
그리고 몇 시간 뒤에 경리부 직원이 와서,
""대표님이 실업급여 받을 수 있게 권고사직 처리해 주신다고 하니, 내일부터 나오지 마세요.""
라고 전하더라고요. 그렇게 해고 통보를 받았습니다.
그때 생각했죠.
'이런 병X 같은 회사 다녀봤자 의미 없다.'
실업급여라도 받으면서 이직 준비하자 싶어서 실업급여를 신청하러 갔어요.
근데 그때도 문제가 있었어요.
제 월급이 당시 최저임금에도 못 미쳤고, 실업급여 담당자가 회사로 전화를 걸었더라고요.
""이 서류 상태로는 실업급여 신청도 안 되고, 근로감독관이 조사 들어갑니다.
서류 다시 작성해서 보내세요."" 이렇게 말이죠.
결국, 제 월급과는 다른 서류들이 만들어졌고, 실업급여 신청은 겨우 이루어졌습니다.
그런데 밀린 월급도 못 받았고, 퇴직금도 못 받았어요.
그 당시 사회초년생이었고, 노동부에 신고하는 건 군대에서 소원수리 긁는 거랑 비슷한
'패배자들이나 하는 짓'이라는 잘못된 사고방식을 가지고 있었어요.
그래서 불합리한 일을 그냥 넘어갔던 기억이 납니다.
얼마 지나지 않아 그 회사는 부도났고, 폐업했다는 소식을 들었습니다.
아직도 이런 회사들이 있을까요?
정말 이런 쓰레기 같은 대표들은 사라져야 하는데...",0,1일 전,2.1k,12,"[{'user': '더미', 'content': '없진 않겠죠.', 'createAt': '1일전'}, {'user': '삶은개발', 'content': '상황이 사람을 만들기도 하죠\n그래도 대표가 잘못한게 백번 맞습니다.', 'createAt': '1일전'}, {'user': 'Woooo', 'content': '', 'createAt': '1일전'}, {'user': '제운', 'content': '노동부에 신고는 최대한 빠르게 해야됩니다. 사장이 해외로 런하면 받을길이 없어서..', 'createAt': '1일전'}, {'user': '우당탕탕 우영우', 'content': '저도 신입때 db가 완전히 날아가 복구 불가였는데 관련팀 15명 정도 모아놓고 당시 신입이였던 저와 제 동기(둘다 입사 1~2주차)한테 x발 니넨 하는게 뭐냐, 개발팀장님한텐 니네 소꿉놀이 하려고 이런애들 앉혀놨냐 등 각종 폭언했었던 적도 있었죠. 당연히 저와 동기는 aws 계정이나 마스터db 접속도 못해봤는데...ㅋㅋㅋ\n선임개발자들한테 물어보니 경력자들한테 뭐라해서 퇴사하면 사람 구하기도 힘들고 누구한테 책임은 물어야했고... 결국엔 회사 망하고 월급, 퇴직금 못받고 여기까지 왔네요..ㅎㅎ', 'createAt': '1일전'}, {'user': 'Client', 'content': '10년 전만 해도 노동법이 제대로 안 지켜질 때라..\n정말 가관이었죠.\n더 심한 사례도 많을 겁니다.', 'createAt': '1일전'}, {'user': '나를씨', 'content': '5년 전 사회 초년생 때 겪었습니다. 월급은 떼이지 않았지만 연봉에 포함인 성과급을 떼였었죠...', 'createAt': '1일전'}, {'user': 'onimusha', 'content': '그럼 대표놈은 지가 뽑은 사람도 아닌데 노동력은 왜 빨고 있었데..', 'createAt': '1일전'}, {'user': 'm.koo.kr', 'content': '저는, 한 회사에 임금체불로 고용노동부에 신고를 2번 해본 적이 있습니다 ㄷㄷ\n당시엔.. 4년차 정도 였고? 이직/퇴직금 이런 경험이 미천했던 시절이었네요\n\n하아.. 그 감독관? 그 새끼가! 진짜 ㅄ 이었는데..\n저랑 회사대표를 같이 불렀더라구요?\n둘 다 앞에 앉혀놓고는? ""합의하세요"" 이랬던 ㅋㅋㅋ\n(할많하않)\n\n""고용노동부에 신고 넣은 게 너 였구나?"" 라고 밝혀진 거 자나요 ㅋㅋㅋ\n\n그러다가.. 2개월쨰 급여 입금 안되는 거 보고서..\n바로! 구직 시작해서 채용되자마자 탈주했던 기억이 있습니다', 'createAt': '약 24시간전'}]"
okky,lifeStory,캐티,3글자 ..,"하루 종일 생각 하였어요.
HNH ARM AMD(+ ATI) KOG Alpabet Tesla Ahnlab 위키 페이지를 나열하고 보았는데 진전이 있었어요!
예전에 스버라 부르는 지인의 회사가 벤처기업에서 없어졌는데 3년이 지나서 지원이 끝난거라고 하빈다. 오키코리아는 아직 벤처기업으로 등록되어 있어요.
어느새 3년이나 지나가서 말이어요. 4년이 지났다 생각하였는데 카카오톡 게시판에 남아있는 노트를 참고하면 이제 막 3년 근접이었어요.
방어 씬에서 인사 담당자가 잠깐 나오고 진용진이랑 회사 대표자가 나오저. 둘 다 젊은 나이로 알고 있는데 대표는 별명으로 훈남 스타버스트라고 불렀스빈다. 훈남은 아이언맨1편 처음 씬에서 스타크 인더스트리 CEO로 나오는 토니가 친구에게 훈남 전용이라고 대사를 친 것에서 떼왔고, 스타버스트는 목소리에서 그냥 어느 만화가에 OC 케릭터가 생각나서 그 이름을 그대로 떼왔쩌. 신기하빈다.
영상에 나온 회사에 조금 곤란한 기회가 2021년 9월 즈음에 있어서 6개월 동안 실제로 가있었는데, 자주 파티션에 팔을 걸고 핵심 직원 앞에서 귀찮게 굴었어요! 자정이 넘어가는데도 집에 안 가고 있으면 옆에 가서 허튼 소리도 하였는데 가끔은 .. 해드락도 걸고요. 이 사무실은 환기 안 하여서 먼지가 아주 많은 디버프가 항상 걸려 있었쩌 ..
스버네 직원이 실력도 엔간하다면서 대기업에 고액 연봉을 받으면서 일하면 어떠냐고 하였는데, 솔까 잼민이 개발자 시절에 자비스 ai만이라도 구현해보고 싶다 였는데 지금은 오픈소스이어서 이제는 ai로봇을 만들고 싶고, 이럼 임직원이 아니라 CEO를 하여야 하빈다.
결과적으로 하루 종일 생각하고, 검색하고 알아낸거는 법인을 여러 개 낼 수 있다는 거여요. 이럼 게임 ai .. 무엇이든 나누어서 절세하겠쩌. 이 이야기는 먼 훗날 이고, 잔잔한 순이익은 간이사업자에 하면 좋다는 것이어요. 대충 애드센스 같은 거여요.
법인 회사 이름을

이런 모양새로 정했어요. 애초에 간이과세 사업자 이름은 아무거나 하여도 되는데 집착이 생겨서 앵간하게 찾았어요. 사실 홈텍스 0시 ~ 7시 점검시간이 걸려서 실제로 신청이 가능한 이름인지는 아직 모르겠고, 검색하면 안 나오는 이름이면 되었고, 세무 정보도 찾아보았는데 이것도 혼동이 되어서 자동화를 하여야 하겠어요. 자동화 ..
..
너무 많아져서 갑자기 하기 싫어졌스빈다 ㅠ
개발비가 해결되면 라이라 하트스트링스님을 데려와서 자동화를 만들면 어떻겠나요.",https://file.okky.kr/images/1734992731507.png,1일 전,391,1,"[{'user': 'kenu', 'content': 'Alpabet 오타요\nAlphabet', 'createAt': '1일전'}, {'user': '삶은개발', 'content': 'CNCF\nMETA\nOKKY\n네글자는 어떠신가요', 'createAt': '1일전'}]"
okky,lifeStory,캐티,서버리스를 아시나요,"아 .. 회사 이름 작명을 못하겠어서 망했스빈다.
아마도 .. 알파벳, 테슬라 처럼 단순하게 지어도 상관 없겠쩌.
완전한 서버리스를 구현하는 거는 아니고, 인터넷에 페이지를 게시하였다면, 이 외 데이터 처리는 탈중앙화된 컴퓨터 처리 방식을 사용할 수 있어요. 굳이 블록체인을 구현하지 않아도 원하는 정보서비스를 제공하는데 하자가 없어요.
제로페이가 지난달(2024. 11. 29.)에 수수료 인상 공지를 올렸어요. 수수료가 없다고 홍보하였다가 이게 머나요. 정부에서 예산 지원을 종료하여서 이제는 수수료가 올랐다 하더라도 경쟁력이 집 나가진 않겠지만 이제까지 많은 공공 예산을 사용하고 이케밖에 못하여서 실망, 사실 이케 많은 예산을 부었는데 내가 맡으면 무한 수수료 0원을 했겠쩌.
여담 .. 대구에 소재한 개발 회사로 2019년 4월 22일에 회사명을 변경한 (주)KOG가 있스빈다. NC, HP, CJ 이케 스펠링 두 글자를 사용하고, 해외의 경우에는 AMD, ARM 이런 세 글자도 많쩌.",0,2일 전,764,1,"[{'user': 'kenu', 'content': '공공 예산과 캐티님 상관은 있는 글 맞나요', 'createAt': '2일전'}, {'user': '개발자가아닌조립자', 'content': '캐티님은 해외분이시간요. 글보다보면 한국사람 아닌거같다고 느낄때가.... 그냥 컨셉이신건가요... ? 진짜 시비거는거아니고 궁금해서 여쭤보는겁니다.', 'createAt': '1일전'}, {'user': '삶은개발', 'content': 'QWER 밑에 있는\nASDF 그 언저리 어떠신가요', 'createAt': '1일전'}]"
okky,lifeStory,kenu,LLM 파인 튜닝한 사람 뽑으라는데,"경력 2년차면 연봉이 어마무시할 텐데,
상관없다고 하지만
beomi, teddynote 님에게 추천 받는 게 낫겠죠.",0,2일 전,750,0,"[{'user': 'kenu · 작성자', 'content': '혹시나 가능하신 분이 있을까\n약간 2000년 이력서 검토할 때\n자바 9년차 이력서 보면서, 잘 모르는 분들은 와 이거 좋다 하겠죠', 'createAt': '2일전'}, {'user': '캐티', 'content': '이것도 앵간하게 달라붙어야 하는 작업으로 전망되어요. 앵간하게 달라붙는 작업에 많이 도전한다 하더라도 짐 다른 일까지 맡아서 할 여력이 없쩌 ㅠ. 사실 llm을 다른 기법으로 구현하여서 파인 튜닝이 없어도 되거나 지금보다 간편하게 되는 방법이 좋음으로 전망합니다.', 'createAt': '2일전'}, {'user': '한안아', 'content': '파인 튜닝도 연봉이 높나요?', 'createAt': '1일전'}]"
okky,lifeStory,0백엔드화이팅0,직장생활 해본 적 없는 취준생의 어이없는 질문입니다..,"회사에서 갈굼 당한다, 쌍욕 먹는다는 의미가
진짜로 ""야이 xx야!!!!!""와 같은 말들을 듣는 것인지
아니면 ""(이름)씨는 왜 이렇게 서툴러요? 좀 더 잘 못해요?""이런 식으로 다그쳐지는 것을 말 하는 건지
궁금합니다..
후자는 괜찮지만 전자는 와...
그리고 패드립을 하는 경우도 있는 지 궁금합니다.
만약 있다면 강도가 ""니 애x 창x야?"" 정도인지
아니면 ""부모님한테 교육 안 받으셨어요?"" 정도인지..
사회는 진짜 무섭고 살벌한 곳이니 미리 어느정도는 명치에 힘 주고 있고싶어서 여쭈어봅니다..",0,2일 전,938,0,"[{'user': 'm.koo.kr', 'content': '회바회지만? 부모님의 안부를 묻는 정도까진 보통 안하구요..\n\n[순화된 표현]\n""너의 두개골 안에 들어있는 건? 우동사리 2인분이니?""\n같은.. 정도의 얘기를 듣는 곳은? 종종 있지 않던가요? ㅎㅎ\n\n하지만! 직속 선배들과의 관계를 우호적으로 구축하고!\n일을 ""빠릿빠릿""하게 잘하면! 실수 좀 해도? 선배들이 커버 쳐주고! 그러기도 하죠..\n\n신입이 잘해봐야 얼마나 잘하겠습니까?\n회사 입장에선? 갓 자대배치 된 이등병이나 마찬가진데요 ㅎㅎ', 'createAt': '2일전'}, {'user': '몰랑토끼', 'content': '직급에 나이묻는곳은 반말이 베이스라고 생각하면됨', 'createAt': '2일전'}, {'user': '캐티', 'content': '위디스크 .. 뚜꾸맞았지 않았나요. 물론 불법이어서 흔하게 볼 수 없쩌. 정말 무섭고 살벌한 시꺼먼 기업에 가지 않으면 대빈다. 대기업에 가면 되지 않나요.', 'createAt': '2일전'}, {'user': 'hswdreamer', 'content': '쌍욕하는 거의 회사 없어요.\n혹시라도 했으면 위에 신고 하고\n제대로 처리 안되면 도망 쳐야 됩니다.', 'createAt': '1일전'}, {'user': '개이득인개발', 'content': '쌍욕은 본적없고, 반말은 꽤 있습니다.', 'createAt': '1일전'}, {'user': '으헝러헝헝', 'content': '저는 전자로 갈굽니다.', 'createAt': '1일전'}, {'user': 'qwer1232', 'content': '후자', 'createAt': '1일전'}, {'user': '바보쿠우', 'content': '야이 xx야!!!!! <== 네 하는 사람 있습니다. 그런 말 하는 사람 있는 회사는 바로 도망쳐야 합니다. 사람이 아니거든요', 'createAt': '1일전'}, {'user': 'libedi', 'content': '그렇게까지 안합니다. 군 입대를 앞둔 것처럼 걱정하실 일 없어요.', 'createAt': '1일전'}, {'user': 'leon808', 'content': '힘 주면 오히려 부러집니다\n갈대마냥 그런갑다 내가 부족하지 하고 넘겨야 합니다\n물론 피드백은 넘기지 말고 다 받고요', 'createAt': '1일전'}, {'user': '포항항', 'content': '?? 요즘 전자로 말하면 큰일나요.\n후자도 어지간한 폐급이 여러번 실수하지 않는 이상 저렇게 말 안하고 좋게 타이를 텐데요.', 'createAt': '1일전'}, {'user': 'The Lowly', 'content': '눈치로도 갈굼이... 이있을수 있죠...\n풀어가는 방법이 없다면\n명치에 힘을 주셔야하겠다는 판단이...', 'createAt': '1일전'}, {'user': '월급은나의빛', 'content': '90년대는 대기업에서도 열받은 선배가 후배 세워 놓고 따귀 때리는 일이 간혹 있었죠. (...맞아 본 1인)\n지금은 10살 이상 차이가 나도 존대말을 하는 분위기입니다.', 'createAt': '1일전'}, {'user': '개발자가아닌조립자', 'content': '기업에 따라 다릅니다.\n하지만 요즘 기업들은 좀 많이 달라졌습니다.\n군대도 요즘 옛날 같지 않듯이 말이죠...', 'createAt': '1일전'}, {'user': '자린이_개발자', 'content': '기업문화가 바뀌고 있긴 하지만.. 현실적으로 상급자가 하급자에게\n지시를 내려야 하는 경우가 많으며.. 해당 업무에 대한 책임도 지고 해야 하기 때문에..\n제대로된 지시를 내리기 위해서 존대보단 반말을 하는 경우가 많더군요..\n\n전 솔플이라 그런걸 거의 못겪었지만 ㅋ', 'createAt': '1일전'}, {'user': '토끼발', 'content': '군대도 그정도는 안해요 물론 요즘 군대요', 'createAt': '1일전'}, {'user': 'DEV_verniy', 'content': '요즘 회사에서 상급자가 하급자에게 말 잘못하면 큰일납니다.\n일 처리 잘 못하면 다그치는 정도고, 진짜로 노답 수준으로 못하면서 나아질 가능성이 없다면 그냥 해고하고 말겠죠.', 'createAt': '1일전'}, {'user': '초무쿤', 'content': '저정도는 인성 터진듯 한데.\n세상엔 인성터진 사람 의외로 많지만\n폐쇄적인 조직일수록 터진 인성 그대로 노출되는 경우가 많고\n개방적인 조직일수록 인성 터진놈도 티안나게 조심함(인성터진거 들키면 매장 당할수 있어서)\nPs.\n트레이드오프가 있는듯\n회사: 감옥 (인성 터진 간수들이 랜덤으로 지랄함)\n자영업or프리랜서: 야생 (오늘 자는 꿀잠이 생의 마지막일수도)', 'createAt': '약 15시간전'}]"
okky,lifeStory,Yamaha,회사에서 제 평판이 나쁜것같다는 생각이듭니다,"SI 에서 사수없는 신입으로 들어와서 근 1년간
쭉 개발하였습니다
밥은 원래 따로먹었고요
사실 그동안 사수가 없고 내 업무를 혼자서 했기 때문에 회사 직장상사와 마주칠일도 없었습니다
지원도 항상 거절당했구요

이런 아웃사이더 같은 면이 찍힌것으로 보입니다

대신 팀장님과 업무 관련으로 마찰이있을때가있었습니다
그후로 팀장님은 저를 좀 피하시는것같구요

그래서 저는 곧 프로젝트에서 방출됩니다
곧 새로운 팀으로 이동하게되는데
걍 이직을 하고 새롭게 시작할지
회사에서 준 팀이동을
기회라고생각하고 다른프로젝트 할지 고민입니다",0,2일 전,1.0k,0,"[{'user': 'kenu', 'content': '회사는 요즘 어려운 경제 시기에 매출은 어떤가요.\n이직할 곳은 지인 통해서 가시는 것 추천하고요.\n회사정리, 거자필반 이라고 이년이라고 하죠.\n너무 아쉬워 하지 않으셔도 될 것이라고 생가합니다.', 'createAt': '2일전'}, {'user': '캐티', 'content': '아무리 화가 났다 하더라도 사람을 치거나 물건을 던지면 안되지 않겠나요. 언어적으로 뼈 때리거나 .. 새로운 팀으로 가서 반성하고 나아가면 좋겠어요. 이럼 좋아짐으로 전망하니다.', 'createAt': '2일전'}, {'user': '하두', 'content': '저도 젊을적\n사장님하고 전화하다가\n전화기 던진적이 있었는데,\n살아남으면서\n실력을 키우셔요.\n시간이 지나면,\n모든것은 변한답니다.\n본인 자신도 주변도 세상도~~~', 'createAt': '1일전'}]"
