title,author,company,price,imageUrl,summary
고마워요,이시노리,초록귤(우리학교),25200,https://image.yes24.com/goods/140290593/XL,"“책을 덮는 순간 다시 펼치고 싶다!”
독보적인 프랑스 예술가 듀오 이시노리 그림책 국내 최초 출간
원서의 색감을 오롯이 살린 한국-프랑스 출판사 공동 제작 
페이지마다 쌓아 올린 매혹적인 선과 색채의 아름다움 
독보적인 시선으로 응시한, 오직 두 마디로만 엮어 올린 170여 개의 순간
세계적인 프랑스 예술가 듀오 이시노리의 국내 첫 그림책 『고마워요』가 출간되었다. 마유미 오테로, 라파엘 위르빌레 두 사람으로 이루어진 이시노리는 르몽드, 뉴욕타임스, 포브스, 프랑스 국립박물관연합, 루이 비통, 키엘 등과 꾸준히 협업해 왔으며 두 번의 볼로냐 라가치상 픽션 부문 스페셜 멘션에 선정된 바 있다. 특히 루이 비통 북 컬렉션인 『트래블 북 서울』은 깊이 있는 독창성, 전통과 현대의 조우로 크게 주목받았다.
『고마워요』는 양말과 유리컵처럼 일상의 작은 사물부터 계절, 풍경, 고요와 속삭임 그리고 무서움에 이르기까지 우리 삶의 매 순간을 이시노리만의 놀랍도록 섬세하고 매혹적인 선과 색채로 포착해 낸 책이다. 170여 쪽을 가득 채운 일러스트는 독자를 단숨에 풍성한 이미지의 향연으로 데려가 책을 덮는 순간 다시 펼치고 싶게 만든다. 이시노리를 처음 만나는 독자들을 위해 탁월한 에디토리얼 디렉터이자 다정한 그림책 안내자인 최혜진 작가가 번역과 해설을 맡았고, 원 작업의 색감을 오롯이 살리기 위해 한국-프랑스 출판사가 공동 제작했다.
이 책 속에는 마치 세상에 처음 당도한 아이처럼 세상을 응시하는 시선과 오직 두 마디의 글과 이미지의 결합만으로 일상을 환히 비추는 감사가 가득하다. 『고마워요』는 그림책을 정성스레 아끼는 독자뿐 아니라 이제 막 그림책에 눈 뜬 독자 모두에게 오직 그림책만이 줄 수 있는 고유의 역동과 투명한 감동을 선물할 것이다."
2025 전국 안경점 주소록 CD,한국콘텐츠미디어,한국콘텐츠미디어,215100,https://image.yes24.com/goods/140290491/XL,"전국 안경점·안경원 주소록을 지역별로 10,840건, 안경산업 주소록을 분야별, 지역별로 15,462건, 안경업체 상세정보를 업종별, 지역별로 1,424건, 안과 병·의원 주소록을 지역별로 4,279건을 수록했다."
2025 국가직·지방직 9급 공무원 시험 영어 모의고사 1,원패스 스파르타,노력과땀,13500,https://image.yes24.com/goods/140290130/XL,"2025년 국가직·지방직 9급 공무원 수험생을 위한 교재. 2025년부터 공무원 영어 시험의 출제 기조가 기존의 문법과 어휘 중심에서 독해와 문장 이해 능력, 실제 생활에서 쓰이는 영어 표현과 논리적 사고력 평가로 변경됨에 따라, 수험생들이 실전 감각을 익히며 기출 유형에 익숙해지도록 이를 반영한 모의고사와 해설서 12회 수험서이다. 철저한 출제 경향 분석과 검증된 학습법을 바탕으로 제작된 본 교재는 실전에 강한 문제 해결력을 키우는 데 초점을 맞추고 있다."
2025 로스쿨 민법정리,박승수,에듀비,74000,https://image.yes24.com/goods/140289950/XL,"이번 25년 개정판에서도 변호사 시험문제들과 24년 법전협 출제문제들까지 철저히 분석하여 반복하여 출제되는 판례지문들을 위주로 본서 내용에 실었으며 출제가능한 최근 판례사안을 BOX로 사례화하여 편입함으로써 기본서와 사례의 통일적인 해결이 가능하도록 하였다. 또한, 기출된 부분은 해당부분에 변호사선택?24, 변호사사례?24, 사시 사례 기출, 법무사 사례 기출 등으로 특정하여 중요부분을 집중적으로 공부할 수 있도록 하였다. 최근판례는 2024. 11. 15.자 판례공보에 실린 판례들 중 중요하고 출제가능한 판례들 100여 개를 선별하여 모두 본서의 해당부분에 반영하였다. 특히 공동저당과 명의신탁의 채권자취소권를 분리해서 정리했으며, 집행법 부분을 부동산 강제집행과 채권 강제집행으로 나누어 출제가능한 판례들로만 정리해서 개정하였다."
